{
  "$schema": "http://json-schema.org/draft-07/schema#",
  "title": "Format Showcase Example",
  "type": "object",
  "properties": {
    "email": {
      "type": "string",
      "format": "email"
    },
    "hostname": {
      "type": "string",
      "format": "hostname"
    },
    "ipv4": {
      "type": "string",
      "format": "ipv4"
    },
    "ipv6": {
      "type": "string",
      "format": "ipv6"
    },
    "uri": {
      "type": "string",
      "format": "uri"
    },
    "uriReference": {
      "type": "string",
      "format": "uri-reference"
    },
    "uriTemplate": {
      "type": "string",
      "format": "uri-template"
    },
    "date": {
      "type": "string",
      "format": "date"
    },
    "time": {
      "type": "string",
      "format": "time"
    },
    "dateTime": {
      "type": "string",
      "format": "date-time"
    },
    "regex": {
      "type": "string",
      "format": "regex"
    },
    "uuid": {
      "type": "string",
      "format": "uuid"
    },
    "jsonPointer": {
      "type": "string",
      "format": "json-pointer"
    },
    "relativeJsonPointer": {
      "type": "string",
      "format": "relative-json-pointer"
    },
    "smallInteger": {
      "type": "integer",
      "format": "int32"
    },
    "largeInteger": {
      "type": "integer",
      "format": "int64"
    },
    "floatNumber": {
      "type": "number",
      "format": "float"
    },
    "doubleNumber": {
      "type": "number",
      "format": "double"
    },
    "binaryData": {
      "type": "string",
      "format": "binary"
    },
    "password": {
      "type": "string",
      "format": "password"
    }
  },
  "required": [
    "email",
    "hostname",
    "ipv4",
    "ipv6",
    "uri",
    "uriReference",
    "uriTemplate",
    "date",
    "time",
    "dateTime",
    "regex",
    "uuid",
    "jsonPointer",
    "relativeJsonPointer",
    "smallInteger",
    "largeInteger",
    "floatNumber",
    "doubleNumber",
    "binaryData",
    "password"
  ]
}
